{
  "api_contract": {
    "contract_id": "dronedream.managed.planner.v1",
    "input_schema_version": "dronedream.model-harness-input.v1",
    "output_schema_version": "dronedream.model-harness-output.v1"
  },
  "implementation": {
    "entrypoint": "compile_autonomy_mission",
    "module": "app.autonomy.service",
    "source_path": "services/backend/app/autonomy/service.py",
    "source_sha256": "49f185fb7ba83f3a7005b7a7700d567162c8afddd52bb5baa44b9fbb8973fd7f"
  },
  "plugin_id": "dronedream.managed.planner",
  "schema_version": "dronedream.managed-plugin-manifest.v1",
  "slot": "planner",
  "trust": "managed",
  "version": "1.0.0"
}
